ID,TEXTO,CATEGORIA
371432,"Olá, aluno, meu nome é Monique, eu sou professora de arte e hoje nós vamos falar sobre os polos culturais. Era tal, que antes era a língua oficial Ou seja, muitos artistas migraram para os Estados Unidos e uma das diferenças também do polo cultural que passou lá no século 20 da Europa para os Estados Unidos, é que os Americanos eles gostavam muito de arte moderna Diferentemente dos Europeus. O Gorky Participava desse movimento. Ele teve uma juventude muito pobre: a mãe dele morreu de fome e ele sofreu muito causa da guerra lá. Por isso da imigração... que ele foi para os Estados Unidos quando ele era jovem. Ele tem uma pintura mais automática... de lançar a tinta na tela e deixar o acaso e o aleatório agir por ele. Nós temos também um outro artista que fez parte do ""Expressionismo Abstrato"", que também migrou para os Estados Unidos Que se chama De Kooning. ",Arte
371430,"Olá. alunos. Meu nome é Monique, sou professora de arte. Quem foi que definiu, na época, essa diferenciação de arte superiores de artes e inferiores? Michelangelo, em vida, foi chamado de ""o divino"". Ele foi considerado um gênio ainda em vida, tanto que se produziu, ainda em vida, uma biografia sobre ele. Michelangelo trabalhava com um bloco único de mármore, ou seja, ele não juntava pedaços. Para a gente tocar um instrumento a gente precisa estudar muito a técnica. ",Arte
371429,"Olá, alunos. Meu nome é Monique, sou professora de arte. Eu, como artista, como um profissional da área, posso vender meu produto e mesmo assim não quer dizer que eu vou ser vendido, nunca uma coisa ruim, mas que eu estarei somente fazendo algo que eu gosto e ganhando alguma coisa em troca, e são reflexões para a gente pensar se, na arte, é possível vender a sua obra. E ele conseguia fixar a imagem, e ele fazia imagens abstratas, ele fugia bastante do realismo. Uma das características também do minimalismo, essa escola que McReagen participou, é que os produtos eram feitos em série. Mas, uma delas que nós temos aqui é: quem vai visitar essa obra, no meio do nada? ",Arte
371428,"Olá. alunos. Meu nome é Monique, eu sou professora de arte. Nas ciências humanas, nas ciências, nas exatas, porque com a routlação, com essa classificação, é mais fácil de se aprender, de se compreender estudando. Nós temos uma máscara usada pelos índios Ticuna em rituais, também arte indígena. Uma das curiosidades dessa coroa, é que ela foi feita com um dos maiores diamantes do mundo. Ou seja, todas aquelas obras que estão expostas no museu, principalmente as contemporâneas, que normalmente as pessoas acham que não é arte, para você, é arte? ",Arte
371427,"Olá, meu nome é Monique, sou professora de Arte, e hoje estamos aqui para mais uma aula de Estéticas Urbanas e Cultura Pop, parte dois. Está aqui na apostila: ""Slogan é uma palavra ou frase usada com frequência, em geral, associada à propaganda comercial, política"". Esse slogan ""Paz e amor"" tem a ver, porque esse movimento de pessoas era contra a guerra do Vietnã, Estados Unidos contra o Vietnã, nos anos sessenta. Ela se popularizou mais com esse filme, com o John Travolta dançando. Ela se encaixa num estilo Grunge, que ficou bem famoso no começo dos anos noventa. ""Quando alguém entra em evidência na mídia, é comum encontrarmos sua imagem estampada em inúmeras publicações nas bancas de jornais e revistas -isso como a gente vê até hoje-, nas lojas de vídeos, em várias fitas e, até mesmo em supermercados, encontramos produtos licenciados para utilizar a imagem de tal personalidade."" Bom, o você vai fazer aqui nessa tarefa? ",Arte
371426,"Olá alunos. Meu nome é Monique, sou professora de artes, e hoje eu vim aqui para falar com vocês sobre abstração. Primeiro, para começar eu vou falar a diferença entre o que é figurativo e o que é abstrato, que é o tema da aula, isso é importante. A arte abstrata é geralmente chamada aquela que não imita ou representa a realidade como enxergamos, como eu acabei de explicar. E outro tema que ele gostava bastante, falava muito do despertar espiritual, ou seja, ele falava que a obra de arte tem que fazer com que você se desperte espiritualmente. Ou seja, ele falava que cada coisa tinha uma essência, e a função do artista é mostrar essa essência, e ele buscava simplicidade. na obra dele a essência da arte era o principal. ",Arte
371425,"Olá alunos. Meu nome é Monique, sou professora de artes e estamos aqui para falar da aula sobre experimentalismo. Óbvio. Bom, nós temos aqui, a valorização da experiência. Ela já fez obra de arte usando cílios, tem uma outra obra dela que ela passou muito rímel e piscou no quadro, deu tipo centenas (não sei quantos milhares de piscadas), e ela fez esse quadro com os cílios dela. Bom, aqui o ""Cremaster"" é uma série de cinco filmes, são filmes bem abstratos que não tem uma narrativa em si, que é muito estético, é muito visual, então tem imagens muito bonitas, muito estéticas, parece um quadro só que em cinema. Porque o que interessa aqui é a ideia, não tanto se eu, um artista, estou assinando, eu fiz cada detalhe da minha obra. ",Arte
371424,"Olá alunos, meu nome é Monique, sou professora de arte e estamos aqui mais um dia para falar sobre a aula da influência da indústria nas artes. As grandes massas camponesas, para trabalharem nas indústrias, vem para as cidades, acontecendo um crescimento urbano. Só que o Chaplin, depois de um tempo, ele foi acusado de comunista, né? Então ele sofreu um pouquinho de perseguição e tal. É... Então, aqui embaixo, a gente tem uma citação da Diana Dominguez que ela fala que é preciso acreditar que o homem constrói seu presente e projeta um futuro cada vez melhor. E daí o exercício da aula é para observar essa imagem e escrever o que ela representa pra você. Então olhando essa imagem aí, o que ela pode representar para você aluno? ",Arte
371422,"Olá alunos, meu nome é Monique, eu sou professora de arte e hoje estamos aqui para falar de uma aula ""A ruptura da figura-cubismo"". Então eu vou falar um pouquinho das características desse movimento e um pouquinho do Picasso e tal, que é um dos pintores mais conhecidos da história da arte, né... Então muita gente conhece o Picasso. E Picasso e Braque, os criadores do cubismo foram eles... E os dois realizaram várias pesquisas influenciados pelo por Cézanne, que foi um pintor, descrita como uma maneira de tratar a natureza por meio do cilindro, da esfera, do cone... Então ele tratava a natureza, mostrava essa imagem desse desenho por meio dessas formas geométricas, né. Então a gente vê aqui um quadro ""Retrato de Uma Mulher"", do Picasso, então pra quem não conhece arte e tal a gente fala ""nossa isso é uma mulher?"", é sim. A gente vê aqui... Avignon era uma região na... Uma região onde se abrigavam muitos prostíbulos, então ele, o Picasso retratou prostitutas, então é um quadro bem forte né. Daí a gente vê essas mulheres nuas e tal. Então ele recortava pedaços de jornais, ele escrevia, ele colava coisas literalmente no quadro. E ele gostou muito de cerâmica também, como eu já havia dito. ",Arte
371421,"Olá, aluno. Estamos aqui. Meu nome é Monique, para quem não me conhece, sou professora de arte e hoje nós vamos falar sobre um tema muito legal que se chama ""os caminhos da vanguarda"", aula número 9 do caderno conceito moderno. O que a gente pode falar? O movimento, os movimentos de vanguarda, são bem característicos lá do final do século XIX, início do século XX Pode me perguntar também, algum aluno pode perguntar: ""mas professora, o que é um movimento?"" Movimento, no que diz a arte, é um grupo de pessoas, um grupo de artistas que normalmente tem uma tendência a pensar filosoficamente ou ter objetivos semelhantes, parecidos. Ao ar livre eles conseguiam ver os efeitos da luz solar sobre a natureza, sobre as cenas que eles gostariam de ver. Na fotografia, retratava muito essa capitação do momento, essas cenas que os pintores mais tradicionais, os pintores mais acadêmicos não retratavam tanto. Bom, descendo aqui, a gente vê o exercício da aula. ",Arte
371420,"Olá, aluno. Meu nome é Monique, eu sou professora de arte e estamos aqui hoje pra falar sobre uma aula que chama ""A ruptura com o teocentrismo - A questão do sagrado e do profano"", que está no caderno de vocês. Então, primeiro, eu queria começar a aula definindo melhor o que significa ""sagrado"" e o que significa ""profano"", porque são definições essenciais para a gente entender a aula. O que está falando aqui no texto? Então não se preocupava muito com a anatomia, e sim com uma representação que não era muito realista. Então eram épocas onde... Como a Europa se beneficiou com as riquezas das colônias, isso gerou uma intensidade no comércio, gerou riquezas. O que é isso? O humanismo é... Deixa eu tomar um pouquinho de água aqui. ",Arte
371419,"Olá, aluno. Eu sou a professora Monique, eu sou professora de arte, e hoje estamos aqui para falar de uma aula super chique que fala sobre o Barroco. No Barroco, nós vemos uma rejeição de alguns ideais clássicos. O corpo, por exemplo, é o homem que se vê na dúvida de gozar dos prazeres terrenos, porém, ele tem a questão divina, ele tem ainda... Que ele não pode fazer tudo o que ele quer na Terra, porque ele tem o céu para conquistar. Então o rosto das pessoas, as expressões, as expressões são muito fortes. Então nessa época também, falando um pouquinho de teatro, na época do Barroco se surgiu a ópera, que era um gênero teatral onde se misturava dança, música, canto... Também surgiu, começou a se popularizar, um gênero que chama ""commedia dell'arte"", que era um tipo de teatro itinerante, que passava de cidade em cidade, onde os atores usavam máscaras, eles eram muito expressivos, eles improvisavam bastante... Quem já ouviu falar da Colombina, do Pierrot, do Polichinelo... São personagens que vieram da commedia dell'arte, que até hoje influenciam os artista, principalmente no teatro. ",Arte
371418,"Olá! Meu nome é Monique, sou professora de Arte e hoje estamos aqui para falar de temas bem interessantes. A Chanel, quando era jovenzinha, já cantou em um café concerto, tipo um cabaré. No começo da carreira dela, ela abriu uma loja de chapéus e começou a fazer sucesso com essa loja, porque ela tinha essa habilidade com costura. A censura brasileira, na época da ditadura, cortou várias partes dessa entrevista. A Jovem Guarda começou em um programa da rede Record que era apresentado pelo Roberto Carlos, pelo Erasmo Carlos e pela Wanderléa. Foi um programa de televisão que fez muito sucesso. Nesse lugar, Atol de bikini, se testavam bombas nucleares, ou seja, fez uma metáfora como o biquíni sendo uma bomba, por quê? Porque causava polêmica, deixa o corpo da mulher mais à mostra. ",Arte
371431,"Olá, pessoal, aqui quem fala é o professor Bruno, sou professor de química do Objetivo e hoje faremos ai alguns exercícios sobre as curvas de solubilidade, vejamos ai a nossa primeira questão que fala, o processo de dissolução do gás oxigênio do ar na água é um processo fundamental para a existência da vida no planeta. Então, em 1 escapa mais do que em 2. Vejamos agora 3 e 4, em Salvador estando a bebida a 7°C, Salvador é uma cidade litorânea, portanto, a temperatura, perdão a pressão, é 1 atm, em Salvador estando a bebida a 15°C, perceba que quanto maior a temperatura, menor a solubilidade dos gases, portanto em 4 o gás vais escapar mais facilmente do que a 7°C, portanto, a alternativa C, de casa, resolve a primeira questão, tá legal. Muito bem. Vejamos a nossa questão de número 3 que fala, baseando-se no gráfico a seguir que relaciona a solubilidade do dicromato de potássio em função da temperatura, pode-se afirmar que quando uma solução saturada que contém dicromato de potássio em 200 gramas de água, olha só que perigo, é resfriada de 60 para 10, a massa do referido sal que precipita vale quanto? O nosso enunciado trouxe um sistema para 200 gramas de água, então olha só, em 60° dá para dissolver 43 gramas do sal em 100 de água, se você tiver o dobro de água, você consegue dissolver o dobro do sal, o dobro de 43 é, justamente, para 86. É isso ai, capriche nessas questões, reveja todos esses assuntos e a gente se vê em uma próxima oportunidade. ",Quimica
371417,"Olá, pessoal, aqui quem fala é o professor Bruno, professor de química do Objetivo e hoje faremos alguns exercícios ai sobre o ciclo da água e o tratamento da mesma. Na hora que a água evapora, os íons permanecem. Vejamos a questão de número 2, ela fala assim: o tratamento necessário à água resultante de um banho mais plausível é aquele em que a água… Se você parar pra pensar, você tem uma sequência padrão, quase sempre, a água passa por grades que fazem uma filtração bem grosseira, depois são adicionados alguns coagulantes para fazer a floculação, com isso você tem a decantação subsequente, depois da decantação você tem a filtração. Essa água filtrada já está em uma fase só, já é homogênea, ai sim a cloração e a fluoretação desta água, se você acompanhar e olhar com muita calma para as alternativas, tem a alternativa d, de dado, ela fala que passa por decantação, filtração cloração e em alguns casos por fluoretação. Hoje em dia a fluoretação já é obrigatória em todo o território nacional, isso evita o excesso do desgaste dos esmaltes dos dentes aí de quem consome essa água, tá certo, uma ação preventiva ai visando a saúde bucal da população. Muito bem, você tem ali inclusive uma figura muito interessante que faz o esquema de toda essa sequência que eu citei agora a pouco para você, tudo bem? Exato, esse procedimento acaba formando principalmente hidróxido de alumínio, que é um sólido gelatinoso e mais denso do que a água, então as partículas em suspensão aderem nesse sólidos gelatinoso que, com o tempo, vai decantando, então uma ótima e inteligente estratégia para tirar partículas que não estão dissolvidas na água. Vejamos a questão de número 4 que fala, além do processo de clarificação, a água ainda não está pronta para ser usada, para garantir a qualidade da água é feita a cloração, acerto de pH e a fluoretação. Esses processos tem como objetivos, respectivamente, então veja lá, justamente cloração, acerto de pH e fluoretação, na letra d de dado, você encontra a ordem correta. ",Quimica
371416,"Olá, pessoal, aqui quem fala é o professor Bruno, sou professor de química do Objetivo e hoje faremos alguns exercícios sobre mol, quantidade de matéria e massa molar. A proporção aqui é entre o número de átomos e a massa, no caso de magnésio, fazendo essa conta adequadamente, ela dá: 0,8 grama, alternativa b, de bola. Tá legal, agora, a massa que foi lançada na atmosfera, foi de 176 toneladas de CO2, 1 tonelada é igual a 10 a 6 gramas, portanto 176 toneladas você pode falar que são 176 vezes 10 a 6 potência, tudo isso em gramas, então 44 está para 6 vezes 10 a 23, assim como 176 vezes 10 a 6 está para x. Fazendo essa conta você chega ao valor de 2,4 vezes 10 a 30 moléculas de CO2, isso foi lançado na atmosfera e a alternativa correta é a letra A, Fazendo a questão de número 3, ela fala, a quantidade de matéria n é o número de partículas medido em mols, quantos mols de átomos de mercúrio existem em 100 cm cúbicos de mercúrio? Então, veja lá nossa resolução, 200 gramas você tem 1 mol, então 1360 você tem n, essa é quantidade em mols que você tem para calcular. ",Quimica
371415,"Olá, pessoal aqui quem fala é o professor Bruno, sou professor de química do Objetivo e hoje faremos algumas questõezinhas sobre as concentrações que você pode adequar as soluções, okay. Muito bem a concentração em mol por litro, exige que você transforme essa massa de 3,42 gramas de açúcar para mol, tudo bem, 342 gramas você tem em um mol, 3,42, X mol. É uma concentração em mol por litro, interessante, e super contextualizada ai no dia a dia de qualquer brasileiro. E assim a gente resolve as questões da nossa aula, tá certo? ",Quimica
371414,"Olá, pessoal, aqui quem fala é o professor Bruno, sou professor de química do Objetivo e agora faremos alguns exercícios sobre soluções e o coeficiente de solubilidade. O coeficiente é o máximo que dá para dissolver de uma determinada substância numa determinada quantidade de solvente naquela temperatura, tá, portanto, a alternativa b de bola é ótima, a solução fica saturada, com 34 gramas de cloreto de potássio dissolvidas e em equilíbrio com 6 gramas de cloreto de potássio em estado sólido, alternativa b, de bola, resolve. Muito interessante, essa é a questão de número 2. E a questão de número 3 é uma questão de alto nível, ela fala o seguinte, tem-se 540 gramas de uma solução aquosa de sacarose, essa solução é saturada, fica importante esse registro, e isso não tem corpo de fundo tudo isso a 50°C, maravilha, qual é a massa de cristais que se separam da mistura quando ela é resfriada para 30°C, os dados que foram fornecidos são os coeficientes de solubilidade a 30°C e a 50°C, veja que a 30 você tem 220 gramas de açúcar para cada 100 de água, são valores reais okay, e a 50°C, você tem 260 gramas de açúcar que você consegue dissolver em 100 gramas de água, bom, vejamos 540 gramas de uma solução, tudo isso a 50°C, te dá, justamente, uma massa de 390 gramas de sacarose e 150 gramas de água, eu fiz essa conta, olhe a nossa resolução, utilizando a proporção que você tem ali pelo coeficiente de solubilidade. 220 estão para justamente 100 gramas, então x ficam para 150, ou no caso y se você preferir. Até mais. ",Quimica
371413,"Olá, pessoal, aqui quem fala é o professor Bruno, sou professor de química do Objetivo e hoje faremos algumas questões sobre concentração de soluções, abordando conceito e a unidade ppm, okay. Bom, vejamos, se você tem 20 ppm de bicarbonato de cálcio, você tem 20 mg desse composto em 1kg desta solução, tudo bem, 20 para 1 kg, se a garrafa tem 1,5 kg de conteúdo total, você vai ter 30 mg, no caso do bicarbonato de cálcio, convertendo isso para grama, você vai ter 0,03 grama do bicarbonato de cálcio, que é o que você tem na letra c de casa. E a questão de número 3 é uma questão, difícil , ela fala o seguinte, o álcool hidratado utilizado como combustível veicular é obtido por meio da destilação fracionada de soluções aquosas, geradas a partir da fermentação da biomassa, durante a destilação o teor do etanol na mistura é aumentado até o limite de 96% em massa, considere que em uma usina de produção de álcool, no caso o etanol, 800 kg de uma mistura etanol água, com concentração de 20% em massa de etanol foram destilados, sendo obtidos 100 kg de álcool hidratado, cuja a concentração é de 96%, não se perca nos dados, a partir disso, é correto concluir que a destilação em questão gerou um resíduo com uma concentração de etanol em massa, então, cuidado, ele quer o quanto que sobrou no resíduo, veja na nossa resolução que foi feito um esquema muito simples para você entender. Pensando na água agora, você tem 640 kg de água no início, na mistura inicial, e apenas 4kg de água nesse destilado, portanto, houve a sobra de 636 kg de água no resíduo, então são 64 kg de álcool e 636 kg de água, se você somar estes dois valores, você fica com 700 kg de massa total, então 700 kg você tem o 100%, 64 kg de etanol você tem esse p, que é a porcentagem de etanol, é a porcentagem de álcool no resíduo, que dá algo em torno de 9,14%, lembre-se de que a porcentagem é a massa do soluto pela massa total da sua solução, por isso a gente fez a soma do 64 com o 636, 64 dividido por 700 dá algo em torno de 9,14%, multiplicando por 100 você obtém porcentagem, sem multiplicar por 100 você obtém esse valor equivalente na forma decimal, a alternativa dessa questão dificílima é a alternativa D, de dado. ",Quimica
371412,"Olá, pessoal, aqui quem fala é o professor Bruno, sou professor de química do Objetivo e hoje faremos algumas questõezinhas sobre diluição e mistura de soluções, okay? É uma questão de diluição bem clássica, bem padrão, muito boa, dê uma caprichada no estudo dessa questão. A questão de número 2 fala: em 100ml de uma solução 0,5 mol por litro de soda cáustica, foram adicionados a 150 ml de uma solução 0,8 mol por litro da mesma base. Questão 1 é o clássico da diluição, questão 2 é o clássico das misturas, tudo bem? Muito bem, você vai adicionar uma certa quantidade ainda desconhecida de água, para que esta concentração chegue, justamente, em 5%. Essa conta que foi feita ai de 5% vezes 100 mais X, tudo isso igual a 10, onde 10 é a concentração inicial em porcentagem, te permite calcular o X, que é o quanto de água que você adicionou nessa sua solução, tudo bem? ",Quimica
371411,"Olá, pessoal, aqui quem fala é o professor Bruno, sou professor de química do Objetivo e hoje faremos alguns exercícios sobre poluição das águas, okay. Item 2, variação do pH em função da distância e da direção da corrente de água, também faz sentido, o rio tem um curso obviamente, então, a partir do ponto do derramamento para trás, ao curso do rio, não teria problema, o problema é dali para a frente deste rio. O rio Tietê é mais ou menos poluído que um outro rio cuja a DBO é de 30 mg/l bom vamos lá, bom a DBO é um parâmetro de poluição de matéria orgânica no rio, quanto maior a DBO, maior a poluição por matéria orgânica desse rio, portanto, o rio Tietê é, de fato, mais poluído por ter 48 mg/l. Esses 48 mg é, justamente, a quantidade de oxigênio necessária para transformar toda essa matéria orgânica em CO2 e água, então, quanto maior a quantidade de matéria orgânica, maior a quantidade de oxigênio necessária para oxidar todo este composto orgânico, todos estes compostos orgânicos ali presentes, em cada litro de água do rio, quanto maior a DBO, mais poluída você tem na água, mais poluição você tem na água. O que significa? Esses metais, eles podem ser absorvidos ai por exemplo, por um ser humano, em baixos teores, em baixas concentrações no corpo dessa pessoa, isso vai gerar uma série de problemas de saúde e, muitas vezes, esses problemas são agudos e gravíssimos, por exemplo, o chumbo pode gerar retardo mental, ele pode, deixar a pessoa fora de si, você tem uma série, tem dezenas de consequências possíveis pela contaminação desses metais pesados, um outro problema vinculado ai a metais pesados, é que eles tem difícil excreção do corpo, eles tendem a se acumular e fica difícil para o nosso corpo eliminá-los pela urina, então, é um problema muito sério e você deve descartar ai corretamente seu lixo, principalmente esse lixo eletrônico, ou mesmo pilhas e baterias, hoje em dia para a lei brasileira qualquer lugar que vende pilha ou bateria teoricamente é obrigado a recebê-las de volta, se você tem pilhas velhas ou usadas, leve a algum mercado onde, teoricamente, eles tem um lixo especial, onde essas pilhas e baterias são levadas à reciclagem, todo esse material tóxico interno é reaproveitado para a confecção de novas pilhas, uma informação importante, do ponto de vista ambiental e sustentável, tudo bem? ",Quimica
371410,"Olá, pessoal! Aqui quem fala é professor Bruno e, agora, nós vamos fazer algumas questõezinhas sobre o seu módulo, ok? Depois da flecha você deve colocar o dois como coeficiente estequiométrico, O3, o três é o subscrito, aquele número pequeno que indica quantos átomos daquele elemento, no caso, o oxigênio, você tem cada uma das moléculas, tá? Três de O2, flecha, dois de O3. O quatro é o coeficiente estequiométrico, aquele número grande que vem à esquerda da substância, CL2 mostra a fórmula desse componente. Vejamos, aqui, a questão número três: ""Em uma transformação química, ocorre alteração da natureza das substâncias com a formação de novas substâncias. Os gases não tóxicos N2 e O2 reagem formando o gás tóxico NO. Escreva a equação química para a reação esquematizada."" Seguindo o mesmo padrão das questões um e dois, você tem, antes da flecha, duas moléculas de cada uma dessas substâncias. Perceba que você não encontra nas alternativas, nenhuma que diga exatamente a quantidade de moléculas que foi colocada no desenho, mas você consegue uma que tem a simplificação desses valores diretos, tudo bem? ",Quimica
371409,"Olá, pessoal, aqui quem fala é o professor Bruno, sou professor de química do Objetivo e hoje vamos fazer alguns exercícios sobre dispersões e coloides. Bom, as soluções tendem a ser transparentes e os colóides tendem a ter efeito Tyndall, que é o efeito do espalhamento de luz, então se esse feixe de luz é espalhado, se você consegue ver algo turvo, pela dispersão da luz, você tem ali, com certeza, uma dispersão coloidal. Então tá ai, é assim que você diferencia uma solução de uma dispersão coloidal, tá legal, eu te vejo em uma próxima oportunidade e até mais. ",Quimica
